{
  "schemaVersion": 3,
  "id": "mau-mau-rebellion-a-history-from-beginning-to-end",
  "slug": "mau-mau-rebellion-a-history-from-beginning-to-end",
  "metadata": {
    "title": "Mau Mau Rebellion: A History from Beginning to End",
    "author": "Hourly History",
    "description": "",
    "cover": "/covers/mau-mau-rebellion-a-history-from-beginning-to-end.jpeg",
    "language": "en",
    "pageCountEstimate": 40,
    "publishedYear": 2020
  },
  "narrators": [],
  "sections": [
    {
      "id": "sec-1",
      "kind": "front",
      "passages": [
        {
          "id": "sec-1-p0",
          "index": 0,
          "type": "image",
          "text": ""
        }
      ],
      "children": []
    },
    {
      "id": "sec-2",
      "kind": "unknown",
      "passages": [
        {
          "id": "sec-2-p0",
          "index": 0,
          "type": "heading",
          "text": "MAU MAU REBELLION",
          "level": 1
        },
        {
          "id": "sec-2-p1",
          "index": 1,
          "type": "heading",
          "text": "A History from Beginning to End",
          "level": 3,
          "marks": [
            {
              "start": 0,
              "end": 31,
              "kind": "em"
            }
          ]
        },
        {
          "id": "sec-2-p2",
          "index": 2,
          "type": "paragraph",
          "text": "Copyright \u00a9 2020 by Hourly\u00a0History."
        },
        {
          "id": "sec-2-p3",
          "index": 3,
          "type": "paragraph",
          "text": "All rights reserved."
        }
      ],
      "children": []
    },
    {
      "id": "sec-3",
      "kind": "front",
      "passages": [
        {
          "id": "sec-3-p0",
          "index": 0,
          "type": "paragraph",
          "text": "Table of Contents"
        },
        {
          "id": "sec-3-p1",
          "index": 1,
          "type": "paragraph",
          "text": "Introduction"
        },
        {
          "id": "sec-3-p2",
          "index": 2,
          "type": "paragraph",
          "text": "Background and Causes"
        },
        {
          "id": "sec-3-p3",
          "index": 3,
          "type": "paragraph",
          "text": "The Desire for Freedom"
        },
        {
          "id": "sec-3-p4",
          "index": 4,
          "type": "paragraph",
          "text": "The Early Months of the Uprising"
        },
        {
          "id": "sec-3-p5",
          "index": 5,
          "type": "paragraph",
          "text": "The British Respond: Operation Anvil"
        },
        {
          "id": "sec-3-p6",
          "index": 6,
          "type": "paragraph",
          "text": "Brutality and War Crimes"
        },
        {
          "id": "sec-3-p7",
          "index": 7,
          "type": "paragraph",
          "text": "The End of the Rebellion"
        },
        {
          "id": "sec-3-p8",
          "index": 8,
          "type": "paragraph",
          "text": "Legacy"
        },
        {
          "id": "sec-3-p9",
          "index": 9,
          "type": "paragraph",
          "text": "Conclusion"
        },
        {
          "id": "sec-3-p10",
          "index": 10,
          "type": "paragraph",
          "text": "Bibliography"
        },
        {
          "id": "sec-3-p11",
          "index": 11,
          "type": "paragraph",
          "text": "Your Free eBooks!"
        }
      ],
      "children": []
    },
    {
      "id": "sec-4",
      "kind": "unknown",
      "passages": [
        {
          "id": "sec-4-p0",
          "index": 0,
          "type": "heading",
          "text": "Introduction",
          "level": 1
        },
        {
          "id": "sec-4-p1",
          "index": 1,
          "type": "paragraph",
          "text": "The Mau Mau Rebellion, also known as the Mau Mau Uprising, took place in Kenya between 1952 and 1960. It was a conflict between Kenyan peoples\u2014primarily from the Kikuyu tribe\u2014and Great Britain."
        },
        {
          "id": "sec-4-p2",
          "index": 2,
          "type": "paragraph",
          "text": "Kenya had been a British colony since 1920 and under formal British control since 1895. The conflict began when members of several tribes joined to form the Kenya Land and Freedom Army (KLFA), a revolutionary force which formed in opposition to colonial rule by Great Britain. Initially, the fighting was sporadic, but as Britain came to recognize the uprising as a threat to their interests, military action was ramped up."
        },
        {
          "id": "sec-4-p3",
          "index": 3,
          "type": "paragraph",
          "text": "The British responded to the Mau Mau Rebellion, whose tactics were mainly guerilla fighting, in three ways. First, they descended on the city of Nairobi to find and relocate any and all possible Mau Mau fighters and sympathizers (they primarily targeted Kikuyu people). Second, they attempted land reform, as land distribution was a major cause of discontent among Kenyans. Finally, they initiated a resettlement plan, called the villagization program. This program would outlast the others, as Kenyans\u2014primarily Kikuyu\u2014were housed in everything from settlements to concentration camps, depending on their revolutionary leanings."
        },
        {
          "id": "sec-4-p4",
          "index": 4,
          "type": "paragraph",
          "text": "The Mau Mau Rebellion was a very violent conflict. Several massacres took place, and many civilians were killed. Both sides of the conflict used abhorrent torture techniques. In 2012, Great Britain admitted to committing war crimes during the uprising, though more than likely, both sides were guilty."
        },
        {
          "id": "sec-4-p5",
          "index": 5,
          "type": "paragraph",
          "text": "The Mau Mau Uprising also divided the Kenyan people, both inter- and intra-tribally. The British very much exploited the differences between tribes to their advantage. The Mau Mau Rebellion exacerbated these conflicts, which in turn created issues in the new country of Kenya once Britain granted independence in 1963."
        },
        {
          "id": "sec-4-p6",
          "index": 6,
          "type": "paragraph",
          "text": "Unlike other rebellions and revolutions in global history (particularly in the twentieth century when many former European and American colonies fought for independence), historians still disagree on whether the Mau Mau Uprising was an actual revolutionary movement or not. In fact, Kenyans themselves still have a difficult time locating it within their national story."
        },
        {
          "id": "sec-4-p7",
          "index": 7,
          "type": "paragraph",
          "text": "Regardless of the varying interpretations among historians, the Mau Mau Uprising is certainly a key event not only in Kenyan history but in the history of British colonialism and African history in general. It has a complicated and nuanced story, as well as a conflicted legacy."
        }
      ],
      "children": [],
      "title": "Introduction"
    },
    {
      "id": "sec-5",
      "kind": "unknown",
      "passages": [
        {
          "id": "sec-5-p0",
          "index": 0,
          "type": "heading",
          "text": "Chapter One",
          "level": 2
        },
        {
          "id": "sec-5-p1",
          "index": 1,
          "type": "heading",
          "text": "Background and Causes",
          "level": 1
        },
        {
          "id": "sec-5-p2",
          "index": 2,
          "type": "heading",
          "text": "\u201cOne hundred sixty Gusii have not been killed outright without any further casualties on our side. . . . It looks like a butchery. . . . Surely it cannot be necessary to go on killing these defenseless people on such an enormous scale.\u201d",
          "level": 4
        },
        {
          "id": "sec-5-p3",
          "index": 3,
          "type": "heading",
          "text": "\u2014Winston Churchill",
          "level": 5
        },
        {
          "id": "sec-5-p4",
          "index": 4,
          "type": "paragraph",
          "text": "The British had claimed the region known as Kenya as a protectorate in 1895, solidifying their presence there. It did not become a formal colony, though, until after World War I in 1920."
        },
        {
          "id": "sec-5-p5",
          "index": 5,
          "type": "paragraph",
          "text": "The British were not a welcome presence in the region by the native inhabitants. From the start, the native peoples in the area, comprised of various localities and tribes, fought against British incursions. There were at least four unsuccessful armed uprisings against British imperial rule in the region of Kenya before the Mau Mau Uprising, the first beginning immediately before 1895. By far, casualties from these uprisings were on the Kenyan side; superior weaponry and lack of concern for Kenyan life led to several massacres. The sheer brutality involved in suppressing these uprisings was in itself a cause of the Mau Mau Rebellion, and one of the reasons it became such a bloody conflict."
        },
        {
          "id": "sec-5-p6",
          "index": 6,
          "type": "paragraph",